doc_id,doc_name,arm_number,position,description,head,title-fill,authors-fill,study_type-fill,arm_efficacy_metric-fill,arm_efficacy_results-fill,arm_description-1-fill,arm_dosage-1-fill,arm_description-2-fill,arm_dosage-2-fill,arm_description-3-fill,arm_dosage-3-fill,arm_description-4-fill,arm_dosage-4-fill,arm_description-5-fill,arm_dosage-5-fill,arm_description-6-fill,arm_description-6,arm_dosage-6-fill,uuid,choice,title-tag,title,authors-tag,authors,study_type-tag,study_type,arm_efficacy_metric-tag,arm_efficacy_metric,arm_efficacy_results-tag,arm_efficacy_results,arm_description-1-tag,arm_description-1,arm_dosage-1-tag,arm_dosage-1,arm_description-2-tag,arm_description-2,arm_dosage-2-tag,arm_dosage-2,arm_description-3-tag,arm_description-3,arm_dosage-3-tag,arm_dosage-3,arm_description-4-tag,arm_description-4,arm_dosage-4-tag,arm_dosage-4,arm_description-5-tag,arm_description-5,arm_dosage-5-tag,arm_dosage-5,arm_description-6-tag,arm_dosage-6-tag,arm_dosage-6,submit
55d5ef3f-1065-49cf-b81f-4eb22bed3a1d,Wolin-2019-A phase 2 study of an oral mTORC1_m,1,Document Description,A phase 2 study of an oral mTORC1 / mTORC2 kinase inhibitor ( CC-223 ) for non - pancreatic neuroendocrine tumors with or without carcinoid symptoms,DOCUMENT DESCRIPTION,"0,26",,"1,4",,,"7,12,12,15",,,,,,,,,,,"["""",""""]",,5e095c90-205c-4729-b91c-c80b9dfaf1d3,arm_description-1,"0,26",A phase 2 study of an oral mTORC1 / mTORC2 kinase inhibitor ( CC-223 ) for non - pancreatic neuroendocrine tumors with or without carcinoid symptoms,,,"1,4",phase 2 study,,,,,"7,12",mTORC1 / mTORC2 kinase inhibitor,,,,,,,,,,,,,,,,,,,,,,Validate annotation
55d5ef3f-1065-49cf-b81f-4eb22bed3a1d,Wolin-2019-A phase 2 study of an oral mTORC1_m,1,Document Description,A phase 2 study of an oral mTORC1 / mTORC2 kinase inhibitor ( CC-223 ) for non - pancreatic neuroendocrine tumors with or without carcinoid symptoms EdwardWolin edward.wolin@mssm.edu,DOCUMENT DESCRIPTION,"0,26","26,27","1,4",,,"7,12,12,15",,,,,,,,,,,"["""",""""]",,c21d2dcb-f82f-4a11-b6e0-d65042bb2ba7,arm_description-5,"0,26",A phase 2 study of an oral mTORC1 / mTORC2 kinase inhibitor ( CC-223 ) for non - pancreatic neuroendocrine tumors with or without carcinoid symptoms,"26,27",EdwardWolin,"1,4",phase 2 study,,,,,"7,12",mTORC1 / mTORC2 kinase inhibitor,,,,,,,,,,,,,,,,,,,,,,Validate annotation
55d5ef3f-1065-49cf-b81f-4eb22bed3a1d,Wolin-2019-A phase 2 study of an oral mTORC1_m,1,Document Description,"UNITED STATES University of Wisconsin -Madison UNITED STATES UNITED STATES A phase 2 study of an oral mTORC1 / mTORC2 kinase inhibitor ( CC-223 ) for non - pancreatic neuroendocrine tumors with or without carcinoid symptoms September 17 , 2019 September 17 , 2019 September 17 , 2019 10.1371 / journal.pone.0221994 Received : December 3 , 2018 Accepted : July 20 , 2019",DOCUMENT DESCRIPTION,"10,36",,"11,14",,,"17,22,22,25",,,,,,,,,,,"["""",""""]",,1f2b5a26-2036-4ca6-87ca-9947086012ef,arm_dosage-4,"10,36",A phase 2 study of an oral mTORC1 / mTORC2 kinase inhibitor ( CC-223 ) for non - pancreatic neuroendocrine tumors with or without carcinoid symptoms,,,"11,14",phase 2 study,,,,,"17,22",mTORC1 / mTORC2 kinase inhibitor,,,,,,,,,,,,,,,,,,,,,,Validate annotation
55d5ef3f-1065-49cf-b81f-4eb22bed3a1d,Wolin-2019-A phase 2 study of an oral mTORC1_m,1,Paragraph 0,"Neuroendocrine tumors ( NET ) , although generally believed to be uncommon , are the second most common gastrointestinal ( GI ) malignancy , superseded only by colorectal neoplasias [ 1,2 ] . This malignancy is reported to be increasing in prevalence , with the greatest increase in lung , small intestine , and rectal NETs [ 1 ] . Although survival has improved with introduction of newer therapies , prognosis for patients with advanced disease remains poor [ 1 ] .",Introduction,,,,,,,,,,,,,,,,,"["""",""""]",,4536355f-d4f3-43cb-b9f3-4d43276be7dd,title,,,,,,,,,,,,,,,,,,,,,,,,,,,,,,,,,,Validate annotation
55d5ef3f-1065-49cf-b81f-4eb22bed3a1d,Wolin-2019-A phase 2 study of an oral mTORC1_m,1,Paragraph 1,"The phosphatidylinositol-4,5-bisphosphate 3-kinase ( PI3K)-protein kinase B ( AKT)-mammalian target of rapamycin ( mTOR ) signalling pathway , which is inappropriately activated in many cancers , plays a central role in the genesis and progression of NET . The mTOR complex 1 ( mTORC1 ) inhibitor everolimus has become well - established as an effective therapy for NET arising from the pancreas , lung , or GI tract , with an associated median progression - free survival ( PFS ) of 11.0 months [ 3,4 ] . mTOR kinase is a serine / threonine kinase that serves as a core component of two complexes ; mTORC1 and mTORC2 . The former modulates cell proliferation via phosphorylation of eukaryotic translation initiation factor 4E binding protein 1 ( 4E - BP1 ) and p70 ribosomal S6 kinase 1 ( S6K1 ) , whereas the latter acts via phosphorylation of AKT [ 5 ] . Everolimus inhibits the mTORC1 complex but may upregulate mTORC2 , which thus maintains AKT activation . Consequently , inhibitors that can target both complexes may offer clinical advantages in terms of improved efficacy [ 5][6][7][8][9][10 ] .",Introduction,,,,,,,,,,,,,,,,,"["""",""""]",,47720caf-fff2-49f6-a224-c60810f45c0e,title,,,,,,,,,,,,,,,,,,,,,,,,,,,,,,,,,,Validate annotation
55d5ef3f-1065-49cf-b81f-4eb22bed3a1d,Wolin-2019-A phase 2 study of an oral mTORC1_m,1,Paragraph 2,"CC-223 is an inhibitor of TOR kinase in mTORC1 and mTORC2 that is known to overcome mTORC2 feedback pathway upregulation and thus potentially minimize development of therapy resistance due to increased phosphorylation of AKT [ 11 ] . In non - clinical studies , inhibition of mTORC1 and mTORC2 leads to more effective inhibition of cancer cell proliferation than does blocking mTORC1 alone [ 11 ] . In mice bearing human carcinoid xenografts that secrete serotonin , tumors that progressed on rapamycin remained stable or decreased in volume from baseline after treatment with CC-223 [ 12 ] .",Introduction,,,,,,,,,,,,,,,,,"["""",""""]",,2c53de80-44f8-4485-ae8e-99c95aaf6126,title,,,,,,,,,,,,,,,,,,,,,,,,,,,,,,,,,,Validate annotation
55d5ef3f-1065-49cf-b81f-4eb22bed3a1d,Wolin-2019-A phase 2 study of an oral mTORC1_m,1,Paragraph 3,"In a first - in - human study , CC-223 was evaluated as a treatment for patients with advanced solid tumors , and the 45 mg / d dose was established as the maximum tolerated dose ( MTD ) [ 13 ] . Here , we report results of an expansion cohort in patients with non - pancreatic GI or unknown primary NET treated at the previously - established MTD or lower dose if needed .",Introduction,,,"4,8,50,52",,,"9,10","24,28",,,,,,,,,,"["""",""""]",,cfd3dacd-3744-45c1-a4ba-5e80b542a235,arm_description-4,,,,,"4,8,50,52",in - human study expansion cohort,,,,,"9,10",CC-223,"24,28",45 mg / d,,,,,,,,,,,,,,,,,,,,Validate annotation
55d5ef3f-1065-49cf-b81f-4eb22bed3a1d,Wolin-2019-A phase 2 study of an oral mTORC1_m,1,Paragraph 5,"Using the optimal CC-223 dose of 45 mg established in phase 1 [ 13 ] , cohort expansion objectives were to determine the tolerability of CC-223 , characterize the pharmacokinetic ( PK ) and pharmacodynamic ( biomarker ) profiles , and identify a preliminary efficacy signal in seven parallel cohorts of various preselected tumor types ; only the NET cohorts are reported here . Patient flow is shown in Fig 1 . The study ( NCT01177397 ) was conducted in accordance with the International Conference on Harmonisation ( ICH ) E6 requirements for Good Clinical Practice , in accordance with the ethical principles outlined in the Declaration of Helsinki and according to all other national and institutional guidelines . The study protocol was approved by the institutional review boards and other necessary oversight committees at each investigational site (",Study design and participants,,,"16,18",,,"3,4,25,26","6,8",,,,,,,,,,"["""",""""]",,aa6bc537-9df7-4975-9217-370575a73499,arm_dosage-4,,,,,"16,18",cohort expansion,,,,,"3,4,25,26",CC-223 CC-223,"6,8",45 mg,,,,,,,,,,,,,,,,,,,,Validate annotation
55d5ef3f-1065-49cf-b81f-4eb22bed3a1d,Wolin-2019-A phase 2 study of an oral mTORC1_m,1,Paragraph 6,"CC-223 capsules were taken orally once daily in continuous 28-day cycles . An initial cohort started CC-223 at a dose of 45 mg ; this was the maximum tolerated dose ( MTD ) established in phase 1 but , after observing a high rate of dose adjustments due to toxicity among patients with NET , a second cohort started CC-223 at 30 mg . To mitigate toxicity , dosage could be adjusted with either short interruptions , dose level reductions , or every - other - day administration . Treatment was permanently discontinued for disease progression , unmanageable toxicity , patient withdrawal of consent , or other reasons specified by the protocol as requiring study withdrawal .",Procedures,,,,,,"0,1,16,17,59,60","4,11,21,23",,,,,,,,,,"["""",""""]",,91c02e56-7981-4b9b-af60-b2242e2a5549,arm_dosage-5,,,,,,,,,,,"0,1,16,17,59,60",CC-223 CC-223 CC-223,"4,11,21,23",orally once daily in continuous 28-day cycles 45 mg,,,,,,,,,,,,,,,,,,,,Validate annotation
55d5ef3f-1065-49cf-b81f-4eb22bed3a1d,Wolin-2019-A phase 2 study of an oral mTORC1_m,2,Paragraph 6,"CC-223 capsules were taken orally once daily in continuous 28-day cycles . An initial cohort started CC-223 at a dose of 45 mg ; this was the maximum tolerated dose ( MTD ) established in phase 1 but , after observing a high rate of dose adjustments due to toxicity among patients with NET , a second cohort started CC-223 at 30 mg . To mitigate toxicity , dosage could be adjusted with either short interruptions , dose level reductions , or every - other - day administration . Treatment was permanently discontinued for disease progression , unmanageable toxicity , patient withdrawal of consent , or other reasons specified by the protocol as requiring study withdrawal .",Procedures,,,,,,"59,60","4,11,61,63",,,,,,,,,,"["""",""""]",,917ecd70-86a0-43de-a825-ee7afb24fe33,arm_description-3,,,,,,,,,,,"59,60",CC-223,"4,11,61,63",orally once daily in continuous 28-day cycles 30 mg,,,,,,,,,,,,,,,,,,,,Validate annotation
55d5ef3f-1065-49cf-b81f-4eb22bed3a1d,Wolin-2019-A phase 2 study of an oral mTORC1_m,1,Paragraph 7,"Baseline assessments were completed within 28 days prior to first dose of CC-223 . Drug tolerability was continuously evaluated until 28 days after the last dose , using clinical event and laboratory test monitoring comprising a conventional hematologic and coagulation ( if taking anti - coagulants ) panel ; serum electrolytes ; fasting blood glucose ( this also included daily selfmonitoring with finger stick samples for the first month and for longer if necessary ) , HbA 1c , insulin , and c - peptide ; liver enzymes ; serum creatinine ; and protein . Others included serum uric acid , amylase and lipase , lipoproteins , thyroid function tests , creatine kinase , and immunoglobulins including T - cell subsets ( CD4 + and CD8 + ) . We also performed serial triplicate electrocardiograms ( ECGs ) , periodic left ventricular ejection fraction estimations ( echo or multiple gated acquisition [ MUGA ] ) , regular physical exams and vital sign measurements ( heart rate , blood pressure , respiratory rate , and temperature ) . Adverse events were coded with Medical Dictionary for Regulatory Activities ( MedDRA ) version 19.0 . Severity of adverse events was classified using the National Cancer Institute Common Terminology Criteria for Adverse Events ( CTCAE ) version 4.0 . A safety review committee provided study oversight .",Procedures,,,,,,"12,13",,,,,,,,,,,"["""",""""]",,2f485bb7-ff2a-48db-8a0a-e51d9670f3ce,arm_description-1,,,,,,,,,,,"12,13",CC-223,,,,,,,,,,,,,,,,,,,,,,Validate annotation
55d5ef3f-1065-49cf-b81f-4eb22bed3a1d,Wolin-2019-A phase 2 study of an oral mTORC1_m,2,Paragraph 7,"Baseline assessments were completed within 28 days prior to first dose of CC-223 . Drug tolerability was continuously evaluated until 28 days after the last dose , using clinical event and laboratory test monitoring comprising a conventional hematologic and coagulation ( if taking anti - coagulants ) panel ; serum electrolytes ; fasting blood glucose ( this also included daily selfmonitoring with finger stick samples for the first month and for longer if necessary ) , HbA 1c , insulin , and c - peptide ; liver enzymes ; serum creatinine ; and protein . Others included serum uric acid , amylase and lipase , lipoproteins , thyroid function tests , creatine kinase , and immunoglobulins including T - cell subsets ( CD4 + and CD8 + ) . We also performed serial triplicate electrocardiograms ( ECGs ) , periodic left ventricular ejection fraction estimations ( echo or multiple gated acquisition [ MUGA ] ) , regular physical exams and vital sign measurements ( heart rate , blood pressure , respiratory rate , and temperature ) . Adverse events were coded with Medical Dictionary for Regulatory Activities ( MedDRA ) version 19.0 . Severity of adverse events was classified using the National Cancer Institute Common Terminology Criteria for Adverse Events ( CTCAE ) version 4.0 . A safety review committee provided study oversight .",Procedures,,,,,,"12,13",,,,,,,,,,,"["""",""""]",,a843c95c-b69c-400b-89a9-6e1ee4dc2284,arm_description-1,,,,,,,,,,,"12,13",CC-223,,,,,,,,,,,,,,,,,,,,,,Validate annotation
55d5ef3f-1065-49cf-b81f-4eb22bed3a1d,Wolin-2019-A phase 2 study of an oral mTORC1_m,1,Paragraph 8,"Tumors were restaged by the principal investigator at each site using computed tomography ( CT ) , positron emission tomography ( PET)-CT , or magnetic resonance imaging scans after every 2 cycles through cycle 6 , and every 3 cycles thereafter , using Response Evaluation Criteria In Solid Tumors ( RECIST ) version 1.1 criteria for response [ 14 ] .",Procedures,,,,,,,,,,,,,,,,,"["""",""""]",,392d0173-7923-4f7f-b561-cda5c27a5912,title,,,,,,,,,,,,,,,,,,,,,,,,,,,,,,,,,,Validate annotation
55d5ef3f-1065-49cf-b81f-4eb22bed3a1d,Wolin-2019-A phase 2 study of an oral mTORC1_m,1,Paragraph 9,"Metabolic changes were assessed by percent change in total of standardized uptake value ( SUV ) of 2 - 18 F - fluoro-2-deoxyglucose ( FDG ) with PET scanning from baseline to day 15 in cycle 1 . Carcinoid symptoms of flushing and diarrhea were documented monthly with a non- https://doi.org/10.1371/journal.pone.0221994.g001 validated symptom questionnaire that was completed at each study visit . Patients reported whether they had experienced specific events , and the severity and/or frequency of these events . Symptom improvement was defined as � 50 % reduction in frequency and/or a 1-grade reduction in severity for each from baseline .",Procedures,,,,,,,,,,,,,,,,,"["""",""""]",,68c0857b-2143-4bde-835b-f734bae6f63d,title,,,,,,,,,,,,,,,,,,,,,,,,,,,,,,,,,,Validate annotation
55d5ef3f-1065-49cf-b81f-4eb22bed3a1d,Wolin-2019-A phase 2 study of an oral mTORC1_m,1,Paragraph 10,"Central laboratories conducted serial stimulated blood biomarker assays in monocytes ( CD14 + ) for p4E - BP1 and pPKB ( also known as pAKT ) for assessment of mTORC1 and mTORC2 inhibition , respectively . Monthly changes from baseline for chromogranin A ( CgA ) , and for other serum hormones if elevated , were assayed locally .",Procedures,,,,,,,,,,,,,,,,,"["""",""""]",,d150d8fa-a6bc-431c-aade-b9b3bfdad534,title,,,,,,,,,,,,,,,,,,,,,,,,,,,,,,,,,,Validate annotation
55d5ef3f-1065-49cf-b81f-4eb22bed3a1d,Wolin-2019-A phase 2 study of an oral mTORC1_m,1,Paragraph 11,"Blood for PK analysis was drawn on day 1 pre - dose and for up to 48 hours post - dose , and then on day 15 up to 8 hours post - dose . Urine on day 1 was collected within 30 minutes prior to dosing and at intervals up to 24 hours post - dose . Samples were assayed for CC-223 and the principal active metabolite ( M1 ) using validated chiral liquid chromatography mass spectrometry . CC-223 PK parameters were calculated using dosing and sample collection times . Noncompartmental PK analysis was performed used WinNonlin Enterprise version 5.2 Model 200 and Model 210 ( Certara , Princeton , NJ ) .",Procedures,,,,,,"62,63,79,80",,,,,,,,,,,"["""",""""]",,17ea5e6d-b12c-4993-95b0-382d2b6ecc77,arm_description-1,,,,,,,,,,,"62,63,79,80",CC-223 CC-223,,,,,,,,,,,,,,,,,,,,,,Validate annotation
55d5ef3f-1065-49cf-b81f-4eb22bed3a1d,Wolin-2019-A phase 2 study of an oral mTORC1_m,2,Paragraph 11,"Blood for PK analysis was drawn on day 1 pre - dose and for up to 48 hours post - dose , and then on day 15 up to 8 hours post - dose . Urine on day 1 was collected within 30 minutes prior to dosing and at intervals up to 24 hours post - dose . Samples were assayed for CC-223 and the principal active metabolite ( M1 ) using validated chiral liquid chromatography mass spectrometry . CC-223 PK parameters were calculated using dosing and sample collection times . Noncompartmental PK analysis was performed used WinNonlin Enterprise version 5.2 Model 200 and Model 210 ( Certara , Princeton , NJ ) .",Procedures,,,,,,"62,63,79,80",,,,,,,,,,,"["""",""""]",,7525a7d0-895c-47dc-a7e9-16a125ca76a3,title,,,,,,,,,,,"62,63,79,80",CC-223 CC-223,,,,,,,,,,,,,,,,,,,,,,Validate annotation
55d5ef3f-1065-49cf-b81f-4eb22bed3a1d,Wolin-2019-A phase 2 study of an oral mTORC1_m,1,Paragraph 12,"The primary objectives were to investigate the safety and tolerability and determine the preliminary PK of CC-223 administered orally . Secondary objectives were to characterize the PK of M1 , to evaluate the inhibition of mTORC1 and mTORC2 in peripheral blood using p4E - BP1 and pAKT as biomarkers , and to evaluate the preliminary efficacy of CC-223 in terms of tumor response , PFS , and overall survival ( OS ) .",Outcomes,,,,"64,65",,"16,17,57,58",,,,,,,,,,,"["""",""""]",,18b464e6-8c95-4ff6-9013-c114a72be0fd,title,,,,,,,"64,65",PFS,,,"16,17,57,58",CC-223 CC-223,,,,,,,,,,,,,,,,,,,,,,Validate annotation
55d5ef3f-1065-49cf-b81f-4eb22bed3a1d,Wolin-2019-A phase 2 study of an oral mTORC1_m,2,Paragraph 12,"The primary objectives were to investigate the safety and tolerability and determine the preliminary PK of CC-223 administered orally . Secondary objectives were to characterize the PK of M1 , to evaluate the inhibition of mTORC1 and mTORC2 in peripheral blood using p4E - BP1 and pAKT as biomarkers , and to evaluate the preliminary efficacy of CC-223 in terms of tumor response , PFS , and overall survival ( OS ) .",Outcomes,,,,"64,65",,"16,17,57,58",,,,,,,,,,,"["""",""""]",,bb0aac39-2d8a-481f-b230-79beee4b61a6,title,,,,,,,"64,65",PFS,,,"16,17,57,58",CC-223 CC-223,,,,,,,,,,,,,,,,,,,,,,Validate annotation
55d5ef3f-1065-49cf-b81f-4eb22bed3a1d,Wolin-2019-A phase 2 study of an oral mTORC1_m,1,Paragraph 13,"This phase 1/2 study was not powered for inferential statistics and mostly descriptive statistics were used . All patients dosed with CC-223 were included in the safety analysis . The efficacy analysis included all patients completing at least one cycle of drug who had both baseline and one post - baseline tumor efficacy assessment , unless otherwise specified . Categorical baseline variables including tumor type - specific characteristics were summarized using frequency counts and percentage . Continuous demographic and baseline characteristic variables were summarized by descriptive statistics . A Wilcoxon signed rank test was used to analyse change from baseline in serum hormone levels at selected scheduled visits .",Statistical analysis,,,"1,4",,,"21,22",,,,,,,,,,,"["""",""""]",,9c0550b3-1c5d-4f63-8bde-a7de54c0e001,arm_efficacy_metric,,,,,"1,4",phase 1/2 study,,,,,"21,22",CC-223,,,,,,,,,,,,,,,,,,,,,,Validate annotation
55d5ef3f-1065-49cf-b81f-4eb22bed3a1d,Wolin-2019-A phase 2 study of an oral mTORC1_m,2,Paragraph 13,"This phase 1/2 study was not powered for inferential statistics and mostly descriptive statistics were used . All patients dosed with CC-223 were included in the safety analysis . The efficacy analysis included all patients completing at least one cycle of drug who had both baseline and one post - baseline tumor efficacy assessment , unless otherwise specified . Categorical baseline variables including tumor type - specific characteristics were summarized using frequency counts and percentage . Continuous demographic and baseline characteristic variables were summarized by descriptive statistics . A Wilcoxon signed rank test was used to analyse change from baseline in serum hormone levels at selected scheduled visits .",Statistical analysis,,,,,,"21,22",,"21,22",,,,,,,,,"["""",""""]",,a187adab-a7ec-413e-b154-22c3c0df5322,study_type,,,,,"1,4",phase 1/2 study,,,,,"21,22",CC-223,,,"21,22",CC-223,,,,,,,,,,,,,,,,,,Validate annotation
55d5ef3f-1065-49cf-b81f-4eb22bed3a1d,Wolin-2019-A phase 2 study of an oral mTORC1_m,1,Paragraph 14,Best overall tumor response by investigator assessment was summarized using frequency tabulation . Waterfall plots were used to show best percentage change from baseline in the sum of length ( longest diameter ) of target lesions .,Statistical analysis,,,,,,,,,,,,,,,,,"["""",""""]",,156dfedf-b407-48f6-b2b7-1393487be2fc,title,,,,,,,,,,,,,,,,,,,,,,,,,,,,,,,,,,Validate annotation
55d5ef3f-1065-49cf-b81f-4eb22bed3a1d,Wolin-2019-A phase 2 study of an oral mTORC1_m,1,Paragraph 15,Relationship between PFS and NET - specific assessments such as serum hormone levels and carcinoid symptoms were investigated . The Kaplan - Meier estimate of median PFS with its two - sided 95 % confidence interval [ CI ] was provided for each baseline category of the selected biomarkers . Kaplan - Meier plots of PFS were created by category . The raw P value of the log rank test comparing survival distribution of PFS between categories was also provided .,Statistical analysis,,,,"2,3,25,27,26,27",,,,,,,,,,,,,"["""",""""]",,18c16d86-050c-4626-8d2b-767210351ea3,title,,,,,,,"2,3,25,27,26,27",PFS median PFS PFS,,,,,,,,,,,,,,,,,,,,,,,,,,Validate annotation
55d5ef3f-1065-49cf-b81f-4eb22bed3a1d,Wolin-2019-A phase 2 study of an oral mTORC1_m,1,Paragraph 16,"Approximately 40 evaluable patients with NET were planned for further evaluation of safety and preliminary antitumor activity . Patients could receive CC-223 at the MTD and/or a lower dose level based on the safety , PK , and PD data from the dose escalation phase [ 13 ] .",Statistical analysis,,,,,,"21,22",,"21,22",,,,,,,,,"["""",""""]",,6a6e4eb6-00d6-4070-b32f-6697ab2739a4,title,,,,,,,,,,,"21,22",CC-223,,,"21,22",CC-223,,,,,,,,,,,,,,,,,,Validate annotation
55d5ef3f-1065-49cf-b81f-4eb22bed3a1d,Wolin-2019-A phase 2 study of an oral mTORC1_m,1,Paragraph 17,"Enrollment and tumor response rate monitoring were based on Wald 's sequential analysis [ 15 ] . Assuming a target response rate of 20 % for the tumor type of interest ( NET ) , based on the sequential design , with 80 % power to identify the group with 20 % or more response rate at 5 % significance level when the response rate is at 10 % , the enrollment could be stopped for futility when there was no responder out of up to 14 evaluable patients .",Statistical analysis,,,,,,,,,,,,,,,,,"["""",""""]",,d7f1e2a0-7fdf-4997-a8e5-35c977c12d2b,title,,,,,,,,,,,,,,,,,,,,,,,,,,,,,,,,,,Validate annotation
55d5ef3f-1065-49cf-b81f-4eb22bed3a1d,Wolin-2019-A phase 2 study of an oral mTORC1_m,1,Paragraph 18,"The study was conducted between July 2011 and October 2016 at 15 investigational sites . From a total of 58 screened patients , 47 met all eligibility criteria . Of those , the first 24 started CC-223 at the MTD of 45 mg / day and the subsequent 23 started at 30 mg / day . Median age was 63 years ( min - max : 35 - 79 years ) ( Table 1 ) . Men comprised 40 % of the population ; 92 % of patients were white , and 64 % had ECOG performance status score of 1 on entry . Most ( 91 % ) had received prior SSA therapy and 43 % had received additional systemic treatment ; no patient received prior mTOR inhibitor therapy ; however , one patient received concomitant treatment with everolimus . The majority ( 57 % ) had midgut , followed by other GI ( 23 % ) tumors , and 53 % reported NET - related symptoms of either flushing or diarrhea . Eighteen patients ( 38 % ) withdrew from the study due to progression of their disease , 9 ( 19 % ) due to withdrawal of consent , 8 ( 17 % ) due to adverse events , 2 patients ( 4 % ) died , and 10 ( 21 % ) discontinued for other reasons .",Results,,,,,,"36,37","41,45","36,37","51,55",,,,,,,,"["""",""""]",,c6486b78-f9aa-4ab4-a7da-95a0482efec0,title,,,,,,,,,,,"36,37",CC-223,"41,45",45 mg / day,"36,37",CC-223,"51,55",30 mg / day,,,,,,,,,,,,,,,,Validate annotation
55d5ef3f-1065-49cf-b81f-4eb22bed3a1d,Wolin-2019-A phase 2 study of an oral mTORC1_m,1,Paragraph 21,"Mean percent decrease from baseline to day 15 of treatment in [ 18 F]-FDG PET SUV in 31 patients was 32.0 % ( standard deviation 35.2 % ; P<0.0001 , Wilcoxon signed rank test ) . Twentyone patients ( 44.7 % ) exhibited at least a 15 % reduction in uptake and 18 ( 38.3 % ) had at least a 25 % reduction in SUV . These metabolic changes did not correlate strongly with subsequent tumor response outcomes using RECIST criteria ( Fig 2 ) .",Results,,,,,,,,,,,,,,,,,"["""",""""]",,4efd444a-0c48-4b56-bcd8-786f0bb39b10,title,,,,,,,,,,,,,,,,,,,,,,,,,,,,,,,,,,Validate annotation
