doc_id,doc_name,arm_number,position,description,head,title-fill,authors-fill,study_type-fill,arm_efficacy_metric-fill,arm_efficacy_results-fill,arm_description-1-fill,arm_dosage-1-fill,arm_description-2-fill,arm_dosage-2-fill,arm_description-3-fill,arm_dosage-3-fill,arm_description-4-fill,arm_dosage-4-fill,arm_description-5-fill,arm_dosage-5-fill,arm_description-6-fill,arm_description-6,arm_dosage-6-fill,uuid,choice,title-tag,title,authors-tag,authors,study_type-tag,study_type,arm_efficacy_metric-tag,arm_efficacy_metric,arm_efficacy_results-tag,arm_efficacy_results,arm_description-1-tag,arm_description-1,arm_dosage-1-tag,arm_dosage-1,arm_description-2-tag,arm_description-2,arm_dosage-2-tag,arm_dosage-2,arm_description-3-tag,arm_description-3,arm_dosage-3-tag,arm_dosage-3,arm_description-4-tag,arm_description-4,arm_dosage-4-tag,arm_dosage-4,arm_description-5-tag,arm_description-5,arm_dosage-5-tag,arm_dosage-5,arm_description-6-tag,arm_dosage-6-tag,arm_dosage-6,submit
7261b9a8-c661-41cf-bf83-279ce43be30b,Cellini-2019-Pain REduction with bone metastas,1,Paragraph 26,"The PREST trial will provide insight on efficacy of a hypofractionated SBRT IMRT - SIB in pain control with respect to gold standard fractionation . Highlights of this study include personalization by prognostic score stratification , selection based on imaging - driven stability scores , ultra - conformed RT planning , and lower number of RT sessions . To our knowledge , this is the first study design of its kind . The results will clarify if this highly",Conclusions,,,"66,68",,,,,,,,,,,,,,"["""",""""]",,6418fea6-1839-4767-a48d-a3c74749ab4e,study_type,,,,,,,,,,,,,,,,,,,,,,,,,,,,,,,,,,Validate annotation
7261b9a8-c661-41cf-bf83-279ce43be30b,Cellini-2019-Pain REduction with bone metastas,2,Paragraph 26,"The PREST trial will provide insight on efficacy of a hypofractionated SBRT IMRT - SIB in pain control with respect to gold standard fractionation . Highlights of this study include personalization by prognostic score stratification , selection based on imaging - driven stability scores , ultra - conformed RT planning , and lower number of RT sessions . To our knowledge , this is the first study design of its kind . The results will clarify if this highly",Conclusions,,,,,,,,,,,,,,,,,"["""",""""]",,c758dcd7-b353-42f1-abeb-487cd74ced44,title,,,,,,,,,,,,,,,,,,,,,,,,,,,,,,,,,,Validate annotation
bcbf4710-8ae7-4490-9de5-cc28c29f4a6a,"Colombo-2019-Multicenter, randomised, open-lab",1,Document Description,"Multicenter , randomised , open - label , non - comparative phase 2 trial on the efficacy and safety of the combination of bevacizumab and trabectedin with or without carboplatin in women with partially platinum - sensitive recurrent ovarian cancer Multicenter , randomised , open - label , non - comparative phase 2 trial on the efficacy and safety of the combination of bevacizumab and trabectedin with or without carboplatin in women with partially platinum - sensitive recurrent ovarian cancer 20 September 2019 20 September 2019 NicolettaColombo",DOCUMENT DESCRIPTION,"0,40,40,80","86,87","0,14,40,54",,,"23,26",,,,,,,,,,,"["""",""""]",,646e4160-6270-4a3e-95ea-8176260e4d51,arm_description-1,"0,40,40,80","Multicenter , randomised , open - label , non - comparative phase 2 trial on the efficacy and safety of the combination of bevacizumab and trabectedin with or without carboplatin in women with partially platinum - sensitive recurrent ovarian cancer Multicenter , randomised , open - label , non - comparative phase 2 trial on the efficacy and safety of the combination of bevacizumab and trabectedin with or without carboplatin in women with partially platinum - sensitive recurrent ovarian cancer","86,87",NicolettaColombo,"0,14,40,54","Multicenter , randomised , open - label , non - comparative phase 2 trial Multicenter , randomised , open - label , non - comparative phase 2 trial",,,,,"23,26",bevacizumab and trabectedin,,,,,,,,,,,,,,,,,,,,,,Validate annotation
bcbf4710-8ae7-4490-9de5-cc28c29f4a6a,"Colombo-2019-Multicenter, randomised, open-lab",2,Document Description,"Multicenter , randomised , open - label , non - comparative phase 2 trial on the efficacy and safety of the combination of bevacizumab and trabectedin with or without carboplatin in women with partially platinum - sensitive recurrent ovarian cancer Multicenter , randomised , open - label , non - comparative phase 2 trial on the efficacy and safety of the combination of bevacizumab and trabectedin with or without carboplatin in women with partially platinum - sensitive recurrent ovarian cancer 20 September 2019 20 September 2019 NicolettaColombo",DOCUMENT DESCRIPTION,,,,,,"23,27,29,30,63,67,69,70",,,,,,,,,,,"["""",""""]",,d082202a-8845-430a-b269-89cf7ad75508,arm_description-1,,,,,,,,,,,"23,26,29,30,65,66,69,70",bevacizumab and trabectedin carboplatin trabectedin carboplatin,,,,,,,,,,,,,,,,,,,,,,Validate annotation
bcbf4710-8ae7-4490-9de5-cc28c29f4a6a,"Colombo-2019-Multicenter, randomised, open-lab",1,Document Description,Istituto Europeo di Oncologia Milano Italy AlessandraBaldoni Istituto Oncologico Veneto IOV - IRCCS Padova Italy SimonaFrezzini Istituto Oncologico Veneto IOV - IRCCS Padova Italy GiovanniScambia,DOCUMENT DESCRIPTION,,"6,7,15,16,24,25",,,,,,,,,,,,,,,"["""",""""]",,7bf1ab90-b8fc-465e-aaa0-167216a683f4,authors,,,"6,7,15,16,24,25",AlessandraBaldoni SimonaFrezzini GiovanniScambia,,,,,,,,,,,,,,,,,,,,,,,,,,,,,,Validate annotation
bcbf4710-8ae7-4490-9de5-cc28c29f4a6a,"Colombo-2019-Multicenter, randomised, open-lab",1,Document Description,"Multicenter , randomised , open - label , non - comparative phase 2 trial on the efficacy and safety of the combination of bevacizumab and trabectedin with or without carboplatin in women with partially platinum - sensitive recurrent ovarian cancer 20 September 2019",DOCUMENT DESCRIPTION,"0,40",,"0,14",,,"23,26",,,,,,,,,,,"["""",""""]",,6d894b13-c261-436b-9722-310ad23eff3c,arm_dosage-4,"0,40","Multicenter , randomised , open - label , non - comparative phase 2 trial on the efficacy and safety of the combination of bevacizumab and trabectedin with or without carboplatin in women with partially platinum - sensitive recurrent ovarian cancer",,,"0,14","Multicenter , randomised , open - label , non - comparative phase 2 trial",,,,,"23,26",bevacizumab and trabectedin,,,,,,,,,,,,,,,,,,,,,,Validate annotation
bcbf4710-8ae7-4490-9de5-cc28c29f4a6a,"Colombo-2019-Multicenter, randomised, open-lab",2,Document Description,"Multicenter , randomised , open - label , non - comparative phase 2 trial on the efficacy and safety of the combination of bevacizumab and trabectedin with or without carboplatin in women with partially platinum - sensitive recurrent ovarian cancer 20 September 2019",DOCUMENT DESCRIPTION,,,,"23,27,29,30",,,,,,,,,,,,,"["""",""""]",,bfd5484d-996f-4883-a36a-002da14341fa,arm_efficacy_metric,,,,,,,"23,26,29,30",bevacizumab and trabectedin carboplatin,,,,,,,,,,,,,,,,,,,,,,,,,,Validate annotation
bcbf4710-8ae7-4490-9de5-cc28c29f4a6a,"Colombo-2019-Multicenter, randomised, open-lab",1,Document Description,"Multicenter , randomised , open - label , non - comparative phase 2 trial on the efficacy and safety of the combination of bevacizumab and trabectedin with or without carboplatin in women with partially platinum - sensitive recurrent ovarian cancer NicolettaColombo",DOCUMENT DESCRIPTION,"0,40","40,41","0,14",,,"23,24",,"25,26",,,,,,,,,"["""",""""]",,e3567eef-c2e2-49fd-8d25-d01a224a8b27,arm_dosage-6,"0,40","Multicenter , randomised , open - label , non - comparative phase 2 trial on the efficacy and safety of the combination of bevacizumab and trabectedin with or without carboplatin in women with partially platinum - sensitive recurrent ovarian cancer","40,41",NicolettaColombo,"0,14","Multicenter , randomised , open - label , non - comparative phase 2 trial",,,,,"23,24",bevacizumab,,,"25,26",trabectedin,,,,,,,,,,,,,,,,,,Validate annotation
bcbf4710-8ae7-4490-9de5-cc28c29f4a6a,"Colombo-2019-Multicenter, randomised, open-lab",2,Document Description,"Multicenter , randomised , open - label , non - comparative phase 2 trial on the efficacy and safety of the combination of bevacizumab and trabectedin with or without carboplatin in women with partially platinum - sensitive recurrent ovarian cancer NicolettaColombo",DOCUMENT DESCRIPTION,,,,,,"23,24",,"25,26",,"29,30",,,,,,,"["""",""""]",,57285c05-7d6c-4bb7-8f99-cf6aaa439c64,title,,,,,,,,,,,"23,24",bevacizumab,,,"25,26",trabectedin,,,"29,30",carboplatin,,,,,,,,,,,,,,Validate annotation
bcbf4710-8ae7-4490-9de5-cc28c29f4a6a,"Colombo-2019-Multicenter, randomised, open-lab",1,Document Description,"Italy Ginecologica , Milano Italy Multicenter , randomised , open - label , non - comparative phase 2 trial on the efficacy and safety of the combination of bevacizumab and trabectedin with or without carboplatin in women with partially platinum - sensitive recurrent ovarian cancer 20 September 2019 20 September 2019 20 September 2019 10.1038 / s41416 - 019 - 0584 - 5 Received : 28 February 2019 Revised : 27 August 2019 Accepted : 30 August 2019",DOCUMENT DESCRIPTION,"5,45",,"5,19",,,"28,29",,"30,31",,,,,,,,,"["""",""""]",,94df19c3-7f02-44b9-a81a-c865845898c7,arm_description-4,"5,45","Multicenter , randomised , open - label , non - comparative phase 2 trial on the efficacy and safety of the combination of bevacizumab and trabectedin with or without carboplatin in women with partially platinum - sensitive recurrent ovarian cancer",,,"5,19","Multicenter , randomised , open - label , non - comparative phase 2 trial",,,,,"28,29",bevacizumab,,,"30,31",trabectedin,,,,,,,,,,,,,,,,,,Validate annotation
bcbf4710-8ae7-4490-9de5-cc28c29f4a6a,"Colombo-2019-Multicenter, randomised, open-lab",2,Document Description,"Italy Ginecologica , Milano Italy Multicenter , randomised , open - label , non - comparative phase 2 trial on the efficacy and safety of the combination of bevacizumab and trabectedin with or without carboplatin in women with partially platinum - sensitive recurrent ovarian cancer 20 September 2019 20 September 2019 20 September 2019 10.1038 / s41416 - 019 - 0584 - 5 Received : 28 February 2019 Revised : 27 August 2019 Accepted : 30 August 2019",DOCUMENT DESCRIPTION,,,,,,"28,29",,"30,31",,"34,35",,,,,,,"["""",""""]",,9752f85f-0b07-4b38-b08c-5df5ea5db806,title,,,,,,,,,,,"28,29",bevacizumab,,,"30,31",trabectedin,,,"34,35",carboplatin,,,,,,,,,,,,,,Validate annotation
bcbf4710-8ae7-4490-9de5-cc28c29f4a6a,"Colombo-2019-Multicenter, randomised, open-lab",1,Paragraph 0,"The burden of deaths from ovarian carcinoma ( 5 % of all cancer deaths ) is still well ahead of other cancer sites such as leukaemia , non - Hodgkin lymphoma , uterine corpus , liver and brain 1 . Despite the initial good response to complete surgical cytoreduction followed by paclitaxel and platinum - based chemotherapy , most patients still face relapse eventually . The time since last platinum chemotherapy gives a continuum of probability of response to further chemotherapy . Disease that relapses between 6 and 12 months after completion of platinum - based chemotherapy is usually deemed "" partially platinum - sensitive "" and is a field of intense clinical investigation .",BACKGROUND,,,,,,,,,,,,,,,,,"["""",""""]",,cefbcac0-756d-43e1-9b88-b39e0ca406e4,title,,,,,,,,,,,,,,,,,,,,,,,,,,,,,,,,,,Validate annotation
bcbf4710-8ae7-4490-9de5-cc28c29f4a6a,"Colombo-2019-Multicenter, randomised, open-lab",1,Paragraph 1,"Partially platinum - sensitive tumour relapses amounts to about 23 % of all relapses . 2 These patients may respond again to platinum - based therapy , but repeated use can be limited by resistance or intolerance . 3 Trabectedin is an antineoplastic agent with a unique mechanism of action . It binds covalently to the minor groove of DNA and disrupts transcription regulation , leading to G2-M cell cycle arrest and ultimately apoptosis . 4 Preclinical studies indicate that trabectedin , besides having a potent antiproliferative effect , modifies the tumour microenvironment by reducing the number and function of macrophages in the tumour stroma ( tumour associated macrophages - TAM ) . Since TAM produce several angiogenic factors , their inhibition by trabectedin results in an anti - angiogenic effect that is demonstrated well in preclinical systems . 5,6 Bevacizumab is an antibody that binds and inactivates VEGF , the main factor that hypoxic cancer cells produce to stimulate endothelial cell proliferation and angiogenesis . The mechanisms of resistance to bevacizumab are not fully clear yet but it seems likely that the reduced function of VEGF pathways is compensated by overproduction of other angiogenic factors . 3 The combination of compounds that inhibit several angiogenic pathways could , therefore , be advantageous for a prolonged antiangiogenic effect and the combination of trabectedin with bevacizumab inhibit several of these mechanisms at the same time .",BACKGROUND,,,,,,,,,,,,,,,,,"["""",""""]",,e8d405f9-aebc-4ff0-8b73-5ca4d588cce2,title,,,,,,,,,,,,,,,,,,,,,,,,,,,,,,,,,,Validate annotation
bcbf4710-8ae7-4490-9de5-cc28c29f4a6a,"Colombo-2019-Multicenter, randomised, open-lab",1,Paragraph 2,"Preclinical studies in ovarian cancer xenografts have shown synergism between platinum complexes and trabectedin . 7 A phase 1 study in patients with advanced solid tumours showed that the combination is feasible and the recommended dose in carboplatin - pretreated patients is carboplatin AUC 4 and trabectedin 0.8 mg / m 2 every 4 weeks . 8 The partially platinum - sensitive population enabled us to explore though not formally comparing the efficacy and safety profile of two new chemotherapic regimens : a platinum - free regimen with trabectedin and bevacizumab [ BT arm ] and a platinum - based triplet with carboplatin , trabectedin and bevacizumab [ BT+C arm ] .",BACKGROUND,,,,,,,,,,,,,,,,,"["""",""""]",,88b159ec-3e3f-4c6a-b12b-48e615ff7472,title,,,,,,,,,,,,,,,,,,,,,,,,,,,,,,,,,,Validate annotation
bcbf4710-8ae7-4490-9de5-cc28c29f4a6a,"Colombo-2019-Multicenter, randomised, open-lab",1,Paragraph 3,"This multicentre , randomised , non - comparative phase 2 study aimed at assessing the efficacy and safety of two regimens according to a Bryant and Day two - stage design . 9 Eligible patients satisfied these inclusion criteria : cytological or histological diagnosis of epithelial ovarian cancer ( including cancer of the fallopian tube and primary peritoneal cancer ) ; progression - free interval 6 - 12 months ( from the first day of the last cycle of the most recent platinum - based chemotherapy ) ; one or two previous platinum - based chemotherapy lines ; measurable or evaluable disease , as defined by Response Evaluation Criteria in Solid Tumors , version 1.1 ( RECIST 1.1 ) ; life expectancy > 12 weeks ; ECOG performance status ≤2 ; no contraindications to dexamethasone or its equivalent as a premedication for trabectedin . As specified by the International Conference on Harmonisation / Good Clinical Practice ( ICH / GCP ) , patients must give signed written informed consent before randomisation .",Study design and patients,,,"1,11",,,,,,,,,,,,,,"["""",""""]",,6b8c26fd-f071-4839-9efb-c5be55d4b607,study_type,,,,,"1,11","multicentre , randomised , non - comparative phase 2 study",,,,,,,,,,,,,,,,,,,,,,,,,,,,Validate annotation
bcbf4710-8ae7-4490-9de5-cc28c29f4a6a,"Colombo-2019-Multicenter, randomised, open-lab",1,Paragraph 5,"Main exclusion criteria were : prior exposure to trabectedin ; prior progression while on therapy containing bevacizumab or other VEGF pathway - target therapy ; peripheral neuropathy grade ≥2 ; history of other malignancies ; central nervous system metastases ; uncontrolled hypertension or clinically significant cardiovascular disease , HCV positivity ; history of bowel obstruction ( including sub - occlusive disease , related to the underlying disease and history of abdominal fistula , gastrointestinal perforation or intraabdominal abscess ) ; inadequate haematological , renal , bone marrow , or liver function .",Study design and patients,,,,,,,,,,,,,,,,,"["""",""""]",,0812ac4a-70ab-409c-b1c3-e86edb43a2c0,title,,,,,,,,,,,,,,,,,,,,,,,,,,,,,,,,,,Validate annotation
bcbf4710-8ae7-4490-9de5-cc28c29f4a6a,"Colombo-2019-Multicenter, randomised, open-lab",1,Paragraph 6,"Patients entering the BT arm received trabectedin . 1.1 mg / m 2 , into a central venous catheter as a 3-h infusion on day 1 of a 21-day treatment cycle . Premedication for trabectedin was 8 mg oral dexamethasone the day before trabectedin plus 12 mg iv 30 min before , plus 4 mg per os 24 , 48 and 72 h post - infusion . Patients received bevacizumab 15 mg / kg iv on day 1 every 21 days .",Treatment plan,,,,,,"3,5,69,70","70,81","6,7","8,13,21,31",,,,,,,,"["""",""""]",,87c326d6-dd1b-4f1f-916d-35fe022bdbb2,arm_dosage-6,,,,,,,,,,,"3,5,69,70",BT arm bevacizumab,"70,81",15 mg / kg iv on day 1 every 21 days,"6,7",trabectedin,"8,13,21,31",1.1 mg / m 2 3-h infusion on day 1 of a 21-day treatment cycle,,,,,,,,,,,,,,,,Validate annotation
bcbf4710-8ae7-4490-9de5-cc28c29f4a6a,"Colombo-2019-Multicenter, randomised, open-lab",1,Paragraph 7,"From cycles 1 - 6 , patients in the BT+C arm , received carboplatin AUC 4 on day 1 every 28 days , trabectedin 0.8 mg / m 2 on day 1 every 28 days , bevacizumab 10 mg / kg on days 1 and 15 . From cycle 7 treatment was as for BT arm .",Treatment plan,,,,,,"9,11,36,37","0,5,37,46","9,11,23,24","0,5,24,35","9,11,13,14","0,5,14,22",,,,,,"["""",""""]",,90bb67ac-66f1-4cbc-aecd-d26382faa00e,arm_dosage-6,,,,,,,,,,,"9,11,36,37",BT+C arm bevacizumab,"1,5,37,46",cycles 1 - 6 10 mg / kg on days 1 and 15,"9,11,23,24",BT+C arm trabectedin,"1,5,24,35",cycles 1 - 6 0.8 mg / m 2 on day 1 every 28 days,"9,11,13,14",BT+C arm carboplatin,"1,5,14,22",cycles 1 - 6 AUC 4 on day 1 every 28 days,,,,,,,,,,,,Validate annotation
bcbf4710-8ae7-4490-9de5-cc28c29f4a6a,"Colombo-2019-Multicenter, randomised, open-lab",1,Paragraph 8,"Treatment was continued until progressive disease , major toxicity , patient 's intolerance or unwillingness to continue treatment , or at the physician 's discretion .",Treatment plan,,,,,,,,,,,,,,,,,"["""",""""]",,2cc3fca8-a6a1-4ff7-9333-1d6c251444e7,title,,,,,,,,,,,,,,,,,,,,,,,,,,,,,,,,,,Validate annotation
bcbf4710-8ae7-4490-9de5-cc28c29f4a6a,"Colombo-2019-Multicenter, randomised, open-lab",1,Paragraph 9,"Physical and radiological examinations were repeated before the start of treatment and every 12 weeks from enrolment until disease progression or death . Disease assessments were based on RECIST 1.1 criteria Safety All patients were evaluated clinically and with standard laboratory tests before and at each cycle . All adverse events ( AEs ) , graded according to the National Cancer Institute - Common Terminology Criteria for Adverse Events ( NCI CTCAE ) , version 4.0 , were reported until 30 days from the last dose of the study drugs . Serious adverse events ( SAE ) and other adverse events ( AE ) believed to be related to study drugs were reported afterwards .",Evaluation of disease,,,,,,,,,,,,,,,,,"["""",""""]",,4d24cb11-0c0c-4081-aba2-1b5cb802982b,title,,,,,,,,,,,,,,,,,,,,,,,,,,,,,,,,,,Validate annotation
bcbf4710-8ae7-4490-9de5-cc28c29f4a6a,"Colombo-2019-Multicenter, randomised, open-lab",1,Paragraph 10,"Allocation to treatment arm was done centrally using a computergenerated permutated block randomisation procedure with a 1:1 ratio and stratifying by centre . According to Bryant and Day design , two primary endpoints were defined : the rate of patients alive and progression - free at 6 months from study entry and the rate of patients with severe toxicity within 6 months from study entry ( ST-6 ) . The following three conditions were considered as ST-6 events : ( a ) absolute neutrophil count ( ANC ) < 0.5 × 10 9 /L lasting > 7 days or with fever , ( b ) platelets < 25 × 10 9 /L , ( c ) any other NCI - CTCAE grade 3 - 4 non - haematological toxicities that caused permanent interruption of one or more drugs . Primary endpoints were assessed in the per - protocol ( PP ) population that included all patients with no major violations of eligibility criteria who had received at least 12 weeks of treatment ( unless all treatment drugs were interrupted sooner for progressive disease , toxicity or death ) . Women who had not progressed or died before 6 months and without a disease evaluation between week 22 and the 27 were not classified as progression - free and were not considered evaluable for the primary analysis , unless the absence of disease progression was confirmed in the disease evaluations after week 27 . PFS-6 and ST-6 were provided with their 80 % and 95 % confidence intervals .",Statistical analysis,,,,"243,244",,,,,,,,,,,,,"["""",""""]",,dab89ae2-ab79-4257-b709-a544e52a27cc,title,,,,,,,"243,244",PFS-6,,,,,,,,,,,,,,,,,,,,,,,,,,Validate annotation
bcbf4710-8ae7-4490-9de5-cc28c29f4a6a,"Colombo-2019-Multicenter, randomised, open-lab",1,Paragraph 11,For the BT arm we assumed that 35 % PFS-6 ( p 0 ) or less would mean the combination was of no therapeutic interest . For the BT drug combination to deserve further development we set a target PFS-6 of 60 % ( p 1 ) .,Statistical analysis,,,,"9,10",,"2,4",,,,,,,,,,,"["""",""""]",,394641b4-3179-4b61-ae7d-c4dbaa20cb92,arm_description-1,,,,,,,"9,10",PFS-6,,,"2,4",BT arm,,,,,,,,,,,,,,,,,,,,,,Validate annotation
bcbf4710-8ae7-4490-9de5-cc28c29f4a6a,"Colombo-2019-Multicenter, randomised, open-lab",2,Paragraph 11,For the BT arm we assumed that 35 % PFS-6 ( p 0 ) or less would mean the combination was of no therapeutic interest . For the BT drug combination to deserve further development we set a target PFS-6 of 60 % ( p 1 ) .,Statistical analysis,,,,"39,40",,"28,31",,,,,,,,,,,"["""",""""]",,45ec66f3-1bcd-4c1a-ad2e-27b0d092f208,arm_description-1,,,,,,,"39,40",PFS-6,,,"28,29",BT,,,,,,,,,,,,,,,,,,,,,,Validate annotation
bcbf4710-8ae7-4490-9de5-cc28c29f4a6a,"Colombo-2019-Multicenter, randomised, open-lab",1,Paragraph 12,"For the BT+C arm we took PFS-6 40 % at p 0 = and 65 % at p 1 = . As regards the toxicity endpoint , for both the doublet and triplet combinations a ST-6 of 30 % or more would be considered unacceptable , while severe toxicity 10 % or less would be considered promising . Type I and type II error probabilities were set at 10 % , one - sided and 10 % ( power = 90 % ) .",Statistical analysis,,,,"6,7",,,,,,,,,,,,,"["""",""""]",,1d4fd6b0-8823-47c6-a82e-21a55b2a0b50,title,,,,,,,"6,7",PFS-6,,,,,,,,,,,,,,,,,,,,,,,,,,Validate annotation
bcbf4710-8ae7-4490-9de5-cc28c29f4a6a,"Colombo-2019-Multicenter, randomised, open-lab",2,Paragraph 12,"For the BT+C arm we took PFS-6 40 % at p 0 = and 65 % at p 1 = . As regards the toxicity endpoint , for both the doublet and triplet combinations a ST-6 of 30 % or more would be considered unacceptable , while severe toxicity 10 % or less would be considered promising . Type I and type II error probabilities were set at 10 % , one - sided and 10 % ( power = 90 % ) .",Statistical analysis,,,,"6,7",,"2,4",,,,,,,,,,,"["""",""""]",,3a7a341a-8d26-4577-8939-360ab3f9d9c6,arm_efficacy_metric,,,,,,,"6,7",PFS-6,,,"2,4",BT+C arm,,,,,,,,,,,,,,,,,,,,,,Validate annotation
bcbf4710-8ae7-4490-9de5-cc28c29f4a6a,"Colombo-2019-Multicenter, randomised, open-lab",1,Paragraph 13,"The study was divided into two stages , each with pre - set decisional thresholds for efficacy and toxicity ( see Fig . 1 ) .",Statistical analysis,,,,,,,,,,,,,,,,,"["""",""""]",,0f75f771-ffb0-4844-b2ce-befa9d660d3e,title,,,,,,,,,,,,,,,,,,,,,,,,,,,,,,,,,,Validate annotation
bcbf4710-8ae7-4490-9de5-cc28c29f4a6a,"Colombo-2019-Multicenter, randomised, open-lab",1,Paragraph 14,"Secondary objectives of the study were progression - free survival ( PFS ) , overall survival ( OS ) , and the toxicity profile . The secondary efficacy endpoints were evaluated in the PP population . PFS was defined as the time between study entry and progression or death for any cause . Subjects with no recurrence or who died while on study were censored at the last disease assessment date . OS was defined as the time between the study entry and death , regardless of the cause of death . Subjects who were not reported as having died at the time of the analysis were censored at the date they were last known to be alive . Survival curves were estimated by the Kaplan - Meier ( KM ) method .",Statistical analysis,,,,"6,10,11,12,36,37",,,,,,,,,,,,,"["""",""""]",,34ac6977-d16c-4471-9ef7-b4ca800dec4c,arm_efficacy_metric,,,,,,,"6,10,11,12,36,37",progression - free survival PFS PFS,,,,,,,,,,,,,,,,,,,,,,,,,,Validate annotation
bcbf4710-8ae7-4490-9de5-cc28c29f4a6a,"Colombo-2019-Multicenter, randomised, open-lab",1,Paragraph 15,"The toxicity profile was evaluated in the safety population that included all patients without major violations of the eligibility criteria who had received at least one treatment dose . For any single toxicity , the absolute and relative frequencies of events and the highest grade experienced by each subject were provided . Continuous variables were expressed as medians with their interquartile range ( IQR ) . All analyses were done with SAS software , versions 9.4 ( SAS Institute ) .",Statistical analysis,,,,,,,,,,,,,,,,,"["""",""""]",,ea4fb54c-e62e-43ae-a237-6bd7e1df9bc9,title,,,,,,,,,,,,,,,,,,,,,,,,,,,,,,,,,,Validate annotation
